{
  "documentTitle": "Alman: A Simplified Dialect of the German Language",
  "i18n": {
    "de": {
      "documentTitle": "Alman: Ein vereinfachter Dialekt der deutschen Sprache"
    },
    "al": {
      "documentTitle": "Alman: Ein vereinfachte Dialekt der deutsche Sprache"
    }
  },
  "documentVersion": "0.4.2",
  "lastUpdated": "2026-07-08",
  "sections": [
    {
      "id": "introduction"
    },
    {
      "id": "articles"
    },
    {
      "id": "nouns"
    },
    {
      "id": "adjectives-and-adverbs"
    },
    {
      "id": "pronouns-and-determiners"
    },
    {
      "id": "verbs-and-word-order"
    },
    {
      "id": "lexical-gender"
    }
  ]
}